performance_id,review_id,rating,user_id,date,view_count,like_count,title,text
22001159,788,5,qkf1***예매자,2022.07.31,조회 1681,"공감 0
공감하기",베스트말이 필요없는 재미있는 연극,"배우님들의 연기가 ????????????
시간 가는 줄 모르고 봤어요 ㅠㅠ
진짜 실컷 웃고 끝난 너무 재미있는 늘근도둑이야기
실컷 웃어서 너무 행복했던 연극??
배우님들의 티키타카도 너무 웃기고 너무 좋았던 연극
다음에 또 보고싶은 늘근도둑이야기????"
22001159,789,5,yjinre***예매자,2022.07.31,조회 1080,"공감 0
공감하기","베스트실컷 웃다갑니다.
라이브 후기","공연 오랜만에 보는 친구와 관람했어요.
좋은작품 선택한것 같아 기쁩니다.

오랜만에 웃어서 너무 기분좋아요ㅋㅋㅋㅋ
배우님들 너무 감사합니다

응원할게요!!!!"
22001159,790,5,bmw1***예매자,2022.07.26,조회 999,"공감 0
공감하기",베스트K연극!! 웃음최강!,"몇년만에 간 대학로 소극장!이렇게
완벽하게 시간보내는게 즐겁나요?!
사춘기 온 아이들과 코드맞춰 완전 즐겁게 봤습니다!!

보는 내내 즐겁게 좋은시간 만들어 주셔서 감사합니다!!"
22001159,791,5,treen***예매자,2022.07.25,조회 762,"공감 0
공감하기",베스트봄날의 햇살같은 연극,"서울과 아주 가까운 인천
하지만 늘 멀게만 느껴지는 서울
어쩌다 큰맘먹고 나들이에 나서지만 연극을 관람하려는 무수한 인파에 놀라 너무 문화생활과 동떨어져 지낸건 아닌지 돌아봅니다.
무료한 일상에 신선한 웃음을 생각하고 가볍게 볼 연극을 고르던중 선택한 늘근도둑이야기
시작부터 빵빵 터지는 웃음
어릴적부터 함께 자라온 친구는 저의 웃음소리에 덩달아 웃음바이러스라도 전파된듯
마냥 웃었고
오프닝에 가위바위보를 시작으로
취준생의 애환을 10대부터 30대로 나열할땐 또 같이 웃펐답니다.
그후로도 쭉 배우분들의 몸을 사리지 않는 열연과 수많은 에피소드로 꽉채워준 2시간의 웃음
몇년만에 보는 연극이지만 이연극 한편으로
우쭐 하며 온 연극을 다 본것처럼 자랑해야겠어요.
아직도 이걸 안봤냐?
말이되냐?
나른한 일요일 오후에 봄날의 햇살같이 스며든 연극
덕분에 너무 행복한 시간 보냈습니다.
고맙습니다."
22001159,792,5,rlatkddl***예매자,2022.07.24,조회 766,"공감 0
공감하기",베스트웃다가 울다가 나왔어요.,"처음 시작부터 너무 재밌었어요. 관객분들도 많아서 그런지 호응도 너무 잘 돼서 더 재밌었어요. 진짜 소통 연극이네요.
소통하는 연극 좋아하는 분들은 만족하실 거예요. 시간 떼우려고 봤다가 완전 반해서 나왔어요. 부모님이랑 봐도 좋고
연인끼리 봐도 너무 좋고 재밌는 연극이예요. 배우분들도 호응해주면 소소한 것에도 감사해주시고 너무 감동!! ㅎㅎ
생각보다 극장이 작아서 바로 앞에서 보는 기분이라 너무 좋아요. 박철민배우 보려고 연극 봤다가 다른 배우분들도 너무
재밌어서 웃다가 웃었네요. &#128522; 꼭 보세요. 후회는 없는 연극입니다. ㅎㅎ 뭘 봐야할지 모를 때 보면 좋은 연극!!!"
22001159,793,5,sophia42***예매자,2022.07.21,조회 1047,"공감 0
공감하기",베스트오랫만에 본 일한 배우님과 항호 배우님 연극~^^,"&#65279;제가 본 연극을 보게 된 건 친한 여동생의 추천이기도 했고, 워낙 유명한 작품이라 보고 싶었지만
놓쳐왔던 극이라 이번 기회에 보게 되었습니다.
또한, 오래전부터 알고 있던 배우님께서 출연하시기 때문이었는데요,
배우님을 알게 된 건 9년 쯤 되었는데, 배우님의 캐스팅으로 연극을 보게 된 건 5년 만인 것 같아요~
그래서인지 무대 위에서 다시 배우님을 뵙게 되니까 너무 반가워서 ... 소리를 질렀어요~^^
그랬더니 자연스럽게 (?) 같은 극장 건물 위 층에서 진행되고 있는 공연의 티켓도 선물 받게 되어서
무척이나 좋았답니다. ㅎㅎㅎ
저는 늘 연극을 보면 앞 자리를 사수하는 편이고, 앞 지라에서 보는데, 이번에도 맨 앞 자리에서
보게 되었습니다. 그런데, 제 자리가 ... 세상에나 ... 연극의 한 축이 되는 금고 역할일 줄이야 ...
처음에는 살짝 당황하고 해서 눈도 못 쳐다봤는데 나중에는 즐기게 되면서 신선하고 재미있는 경험을
하게 된 것 같아요~^^
연극의 내용을 말하면 스포일러가 될 것 같아서 내용은 여기까지~!!!!!!!
삶이 지치고, 힘든데 웃을 일이 없을 때 이 연극을 꼭 보시라고 추천드리고싶어요~
저도 많이 힘들어 웃을 일이 없는데 보게 되면서 너무 많이 웃고, 즐거웠거든요~^^"
22001159,794,5,lifes***예매자,2022.07.21,조회 691,"공감 0
공감하기",베스트따뜻한 웃음이 가득한 공연,"역시 명불허전! 박철민님의 연기를 볼수 있어서 좋았습니다.
애드리브도 넘 좋았고, 같이 호흡하신 분도 넘 좋았습니다. 마스크를 쓰고있어도 이렇게 관객과 소통할 수 있다는 걸 보여주신거 같았습니다^^
같이 본 친구는 잘 안웃는데 그날은 너무 웃어서 입이 아팠대요 ㅎ

아쉬운건 그날 가까운 곳에서 관람해서 박철민님의 손을 잡을 기회가 한번 있었는데 숫기가 없어서 그 기회를 반대편 분에게 넘겼습니다. 다음에 또 관람할땐 놓치지 않을거에요 ㅎㅎ

그날 너무 재미있게봐서 이전에 생긴 스트레스는 사라지고 좋은 기운만 남은 듯 합니다.

좋은 공연 만들어주셔서 넘넘 감사합니다!^^"
22001159,795,4,cmsz***예매자,2023.07.26,조회 46,"공감 0
공감하기",늘근도둑이야기,"안녕하세요~^^
환갑이 넘은 중년이네요
오랜만에 늘근도둑이야기 연극보러갔더니 더위를 확 날렸네요
남자친구가 연극이 처음이라고 하네요
그래서 같이 갔는데 연극이 이렇세 잼미있고 얼굴보면서 함께호흡하고
너무재미 있었다고 저보고 고맙다고 맛있는 고기를 사주었네요
압으로 자주다냐야겠어요
글구 존경합니다 배우님들 1시간 30분동안 저희들 웃음을 주어서 너무나 감사합니다
배우님들의 앞날에 무궁한 발전이 있으시길 바랍니다~
안녕히 계세요"
22001159,796,5,dkfkqld***예매자,2023.07.25,조회 73,"공감 0
공감하기","오빠??
라이브 후기",정말 끊임없이 웃었던 거 같아요! 배우님들 케미도 좋고 관객들이랑 하나되어 호흡하는 것도 재밌었습니다 내용도 재밌고 신박했습니다 배우님들끼리 당황도 하고 아이컨택도 많이 해주시고 오늘 수사관님 정말 멋지시네요 아직도 잊을 수 없네요 그의 뒷태를용 추천합니다 100시간 금방갑니다! 저는 오빠를 외치고 책을 받았습니다!! 꼭 웃음이 필요할 때 아니 안 필요하셔도 보십시요!
22001159,797,5,rjh9***,2023.07.25,조회 23,"공감 0
공감하기",100분 순삭 추천해요!!,"오랜만에 대학로 연극 뭐 볼까 고만하다
역사와 전통의 늘근도둑 이야기 골랐어요
잠깐에 쉼도 없이 깔깔 박장대소 하면서 봤어요. 남녀노소 모두에게 추천합니다. 약간에 욕설있지만 초고학년부터는 걸러서 이해할 듯 해요"
22001159,798,5,rink***예매자,2023.07.24,조회 18,"공감 0
공감하기",또 보러 올께요.,7년전? 그땐 아이가 어려서 혼자 봤는데 이번엔 20살 된 딸과 같이 봤어요. 넘 재밌게 봤어요.
22001159,799,4,parkm***예매자,2023.07.24,조회 79,"공감 0
공감하기",연극은 첫 관람이었는데,"정말 재미있게 잘 보았습니다.
감사합니다."
22001159,800,5,minba***예매자,2023.07.24,조회 30,"공감 0
공감하기",근10년만에 본 공연,"늘근도둑이야기 옛날부터 재밌다는 소리는 많이 들었었는데 이제야 보게되었네요 20년 넘게 이 공연을 해왔다는 박철민 배우님을 중심으로 총 네명의 배우(미스터리의 이양까지ㅋㅋ)와 관객들까지 함께하는 즐거운 무대였습니다
시작부터 끝까지 두시간가량을 내리 웃다가 나와서 볼따구에 경련이 일어나서 혼났네요^^ 배우님들 무더위에 건강 잘 챙기시고 오래도록 공연해주셨음 좋겠네요! 즐거웠습니다!!!"
22001159,801,5,witche***예매자,2023.07.23,조회 16,"공감 0
공감하기",재밌었어요,시부모심 모시고 갔는데 너무 좋아하셨어요
22001159,802,5,chathank***예매자,2023.07.22,조회 34,"공감 0
공감하기","이럴수가!!! 정말 대단한 연기^^
라이브 후기","처음보는 배우들인데, 오래된 친구같았어요.
어떻게 그러죠?
모르겠어요. 그 친근함과 짠함이 어우러져서
눈물이 나는.. 연기 너무 잘하셔!!!"
22001159,803,5,ktel***예매자,2023.07.18,조회 24,"공감 0
공감하기","정말 잼있게 봤습니다.
라이브 후기",큰 기대를 하지 않았는데 너무 잼있게 웃으면서 봤습니다. 정말 돈 아깝지 않고 아주 만족스럽습니다.
22001159,804,5,r979s***예매자,2023.07.17,조회 45,"공감 0
공감하기",오랜만에 한참 웃었네요!,"회사에는 연차 내고 와이프랑 같이 문화생활을 즐기고자 선택한 연극 ''늘근도둑이야기''

기대 이상으로 1시간 반동안 한참 웃었습니다.

맨 앞자리에 앉아서 주인공님들 숨소리, 움직임 등 너무 실감나게 보고 왔습니다.

다음에는 아이들 데리고 다시한번 보고 싶네요.

늘근도둑 출연진 분들 화이팅 입니다~"
22001159,805,5,pink***예매자,2023.07.17,조회 23,"공감 0
공감하기",빵빵,간만에 빵빵 웃었습니다
22001159,806,5,aorud***예매자,2023.07.16,조회 28,"공감 0
공감하기","웃다가 눈물남
라이브 후기","재미있게 잘봤습니다.
앞으로도 승승장구하세욥 :)"
22001159,807,5,hsyoo0***예매자,2023.07.16,조회 3040,"공감 3
공감하기",무대는 관객이 함께 만든다는 것,"이 연극의 철학 자체 같았다. 스토리 자체는 다른 연극들처럼 짜임새 있고, 권모술수가 오가지 않고 단순하다. 하지만 극중 하나의 틈도 없이 베테랑 배우들의 재치있는 애드리브로 채워져 간다. 같이 연기하는 배우들도 대본에 없는 애드리브라고 느낀건지 놀래 하는 것이 보였다. 매 회차 다른 느낌의 작품이 나올 것 같았다. 스토리보다는 비겁하게(?) 연기력 피지컬로 승부하는 느낌이었다
특히 정말 놀랐던 것은 관객들의 호응이었다. 누가 먼저라고 할 것없이 배우들에 맞춰 반응해주고 극에 함께 참여하고 웃음을 선사했다.
높은 참여도에 배우들도 놀라하고 더욱 적극적으로 극을 만들어 나갔다. 나 또한 여타 본 연극과는 다른 끝없는 리액션과 웃음으로 아무 생각없이 편하게 볼수 있었다.
마지막 커튼콜때 박철민 배우가 말씀하신 관객분들이 연극을 함께 만들어갔다라는게 유독 더 느껴지는 연극이었다."
22001159,808,5,cheju***예매자,2023.07.16,조회 26,"공감 0
공감하기",코믹속에 감동이 있었습니다.,"코믹함 속에 사회문제를 살짝 터치하는 센스가 돋보였습니다.
배우분들의 훌륭한 연기에 찬사를 보냅니다.
더 늘근 도둑님의 중간 중간 나오는 가창력에 놀라움을 금지 못했고,
덜 늘근 도둑님의 순발력 있는 연기와 청중과의 소통능력에 무릎을 쳤고,
수사관님이 이 연극의 배우가 된 계기를 박철민 배우님으로부터 듣고 꿈과 행복으로 가득찬 얼굴을 다시 떠올리게 했습니다.
청중의 마음을 도둑질한 도둑님들의 나이가 들어가도 계속 롱런하면서 연륜의 진정한 맛을 보여주시길 기원합니다."
22001159,809,5,cheju***예매자,2023.07.16,조회 11,"공감 0
공감하기",코믹함이 넘쳐납니다.,"코믹함 속에 사회문제를 살짝 터치하는 센스가 돋보였습니다.
배우분들의 훌륭한 연기에 찬사를 보냅니다.
더 늘근 도둑님의 중간 중간 나오는 가창력에 놀라움을 금지 못했고,
덜 늘근 도둑님의 순발력 있는 연기와 청중과의 소통능력에 무릎을 쳤고,
수사관님이 이 연극의 배우가 된 계기를 박철민 배우님으로부터 듣고 꿈과 행복으로 가득찬 얼굴을 다시 떠올리게 했습니다.
청중의 마음을 도둑질한 도둑님들의 나이가 들어가도 계속 롱런하면서 연륜의 진정한 맛을 보여주시길 기원합니다."
22001159,810,5,uniqu***예매자,2024.03.28,조회 89,"공감 0
공감하기",베스트얼굴 근육이 너무 아파요.,"최근에 별로 웃을 일이 없었는데, 두 시간 내내 폭풍처럼 휘몰아치는 배우들의 미친 연기와 애드립에 영혼이 탈탈 털렸습니다. 같이 간 가족들도 너무 웃어서 몸이 힘들다네요. 카타르시스는 비극을 통해서만 이루어지는게 아니더라구요. 행복한 두 시간을 만들어 준 배우님들과 제작진들에게 감사하다는 말 전하고 싶어요."
22001159,811,5,hsyoo0***예매자,2023.07.16,조회 3040,"공감 3
공감하기",베스트무대는 관객이 함께 만든다는 것,"이 연극의 철학 자체 같았다. 스토리 자체는 다른 연극들처럼 짜임새 있고, 권모술수가 오가지 않고 단순하다. 하지만 극중 하나의 틈도 없이 베테랑 배우들의 재치있는 애드리브로 채워져 간다. 같이 연기하는 배우들도 대본에 없는 애드리브라고 느낀건지 놀래 하는 것이 보였다. 매 회차 다른 느낌의 작품이 나올 것 같았다. 스토리보다는 비겁하게(?) 연기력 피지컬로 승부하는 느낌이었다
특히 정말 놀랐던 것은 관객들의 호응이었다. 누가 먼저라고 할 것없이 배우들에 맞춰 반응해주고 극에 함께 참여하고 웃음을 선사했다.
높은 참여도에 배우들도 놀라하고 더욱 적극적으로 극을 만들어 나갔다. 나 또한 여타 본 연극과는 다른 끝없는 리액션과 웃음으로 아무 생각없이 편하게 볼수 있었다.
마지막 커튼콜때 박철민 배우가 말씀하신 관객분들이 연극을 함께 만들어갔다라는게 유독 더 느껴지는 연극이었다."
22001159,812,5,twinsy***,2023.02.15,조회 2624,"공감 0
공감하기",베스트대학로 최고 코미디 늘근도둑이야기,"10일 금요일에 김상두, 김상묵, 안태영 배우님 페어로 보고 왔습니다. 진짜 시간 가는 줄 모르고 웃으면서 보고 왔습니다. 스트레스가 확 날라라고 정말 웃음이 필요할 때 꼭 봐야 하는 공연입니다. 세 분의 연기와 애드리브 정말 훌륭해서 무대가 꽉찬 느낌이었습니다. 관객을 대하시는 매너도 진짜 훌륭하시구용~!!! 김상두, 김상묵, 안태영 배우님 페어롤 꼭 보시길 추천합니다^^"
22001159,813,4,moon***예매자,2023.01.24,조회 8480,"공감 3
공감하기",베스트박철민 배우님을 보러 갔다가 새롭게 발견한 두 배우와의 만남,"미디어에서만 보아오던 배우를 실제로 보면서 함께 호흡할 수 있는 연극의 매력은 참 오묘하다.
애드립하면 빠지지 않는 대표 배우인 박철민 님을 만나러 오랜만에 대학로에 나가보았다.

연극이라는 무대가 얼마나 소중한지 이미 유명한 배우이지만 관객들과 호흡하려는 진솔한 모습,
그리고 20년 전 이 무대를 보면서 배우의 꿈을 꾸며 드디어 그 무대에 오른 이호연 배우님,
어리지만 더 늘근도둑으로 활약한 노진원 배우님까지,
쉼없이 쏟아내는 대사와 애드립, 그리고 관객과의 호흡은 너무나 멋진 무대였습니다.

연극 자체만으로 보면 스토리가 탄탄하거나 많은 배우들이 꽉 채우는 모습은 아니었지만,
단 3명이라는 배우가 만들어 내는 무게감과 유쾌함은 왜 이 공연이 20년 동안이나 무대에 오르고 있는지를 잘 보여주는 힘이라고 느꼈습니다.

그리고 이날 함께 공연을 관람한 관객분들... 너무 멋진 분들이었습니다.
여러 관객이 함께 참여할수록 더욱 공연이 빛을 볼 수 있는데,
이날의 관객 호응은 넘나 멋진 수준이었습니다. 최고!"
22001159,814,5,nostalgia0***예매자,2022.12.30,조회 2077,"공감 1
공감하기",베스트함박웃음을 선물해 준 연극!,"예전부터 보고싶었던 늘근도둑이야기를 드디어 보고왔습니다.
평일인데도 관객석이 아주 꽉~ 찼더라고요! 전 B열 2번쨰줄에 관람했습니다! 가까워서 너무 좋았어요
관객들과의 소통도 너무 좋고 연극에 진정성과 따뜻함이 느껴졌습니다.
이번엔 혼자왔지만 다음엔 친구들 데리고 한번 더 회전문해야겠어요!
삶에 지쳐있을 관객들에게 커다란 함박웃음 주셔서 정말 감사드립니다ㅠㅠ
덕분에 연극 러닝타임 내내 마음이 따뜻해지고 즐거웠습니다~ㅎㅎ
늘근도둑 앞으로도 대박! 흥행! 이어나가세요~!~!^^
파이팅~!!"
22001159,815,5,heejung2***예매자,2022.08.16,조회 3810,"공감 0
공감하기",베스트관객들과의 소통,"멀리에서 힘들게 올라 갔는데, 비가 갑자기 주륵주륵
해가 쨍쨍이었는데, 다행이도 비 오기전에 들어가서 맨앞자리에 앉을 수 있었다

다행이 하루전인데 자리가 있어서 운이 좋았다.
몇년 만이 아니고 처음으로 맨 앞줄에서 배우 얼굴을 보게 되었다.
등장 신부터 심상치 않았고, 실제로 본것도 처음인데다가 강렬한 포스들이 남달랐다.

3명이 나와서 연극을 하는데, 집중 모드로 인해서 관객들이 제대로 소통을 못해드려서
오히려 미안했다. 배우들은 관객을 위해서 재미있는 전개 줄거리고 이야기를 건네고 있는데
오늘따라 관객들이 유독~ 우리처럼 처음이었나보다 하하하

그리고 금고.... ㅎㅎㅎ 한자리를 집어서 금고 자리를 만들었는데
그게 바로 내 옆자리. 그래서 시선 강탈했다. 나였다면.. 허허ㅓㅎ허허
덕분에 우리 신랑에게도 말을 걸어 주엇고, 저희 커플부부는 잊지 못할
순간을 남길 수 있었다. 중간중간 낯간지럽고 헤프닝도 있었지만 센스있는 연극 배우님들 덕에
기분좋고 재미잇는 유쾌한 연극이 되었다. 너무 고마웠다.

다음에도 말걸어주세요 ㅎㅎ"
22001159,816,5,joohee0***예매자,2022.08.12,조회 5290,"공감 5
공감하기",베스트저는 어제 금고가 되었습니다ㅋㅋ,"친구의 강력추천으로 봐야지 봐야지 했던 연극이라 회사동료를 꼬셔서 예매했는데
이번주 침수피해로 인해 길이 막힌 곳이 많아서 퇴근후 제시간에 갈수있을까하며
걱정하며 어렵사리 갔던 연극인데 다행스럽게도 제시간에 도착하여 연극관람후 엄청 웃었습니다ㅋㅋ

가까이서 보는게 좋을까하며 첫번째줄에 예매를 했었는데,
사람들에게 주목되는걸 별로 좋아하지 않던 저는 그렇게 어제 금고가 되었습니다ㅋㅋㅋㅋ

거의 얼어있다가 몇차례 주목받은후 술먹는 장면에서는 시원하게 안먹을수가 없었어요!
다른 관람객들 호응도 너무 좋아서 더 재미있었던것 같아요~!

마지막에 금고에게 책도 주셔서 감사히 기념품으로 모셔두려합니다. 또 보러 갈께요.
(휴지도 주셨는데....휴지는 고민하다 멀고먼 귀갓길때문에 무대에 살포시 놓고 온거는 안 비밀입니다.)"
22001159,817,5,sbb***예매자,2022.08.02,조회 1913,"공감 0
공감하기","베스트김상묵 김상두 안태영 배우님
라이브 후기","다 보고 일어나는데 넘 웃어서 광대뼈가 너무 아팠어요 ㅋㅋㅋ
지금도 얼얼합니다
더운 날씨에 두꺼운 도둑 의상에 땀 한 바가지 흘리면서도 완벽한 공연보여 주셨습니다
중학생 울 딸램두 역시 프로다움~~!! 감동이었고
넘 재밌게 보았다고 하네요"
22001159,818,5,qkf1***예매자,2022.07.31,조회 1681,"공감 0
공감하기",베스트말이 필요없는 재미있는 연극,"배우님들의 연기가 ????????????
시간 가는 줄 모르고 봤어요 ㅠㅠ
진짜 실컷 웃고 끝난 너무 재미있는 늘근도둑이야기
실컷 웃어서 너무 행복했던 연극??
배우님들의 티키타카도 너무 웃기고 너무 좋았던 연극
다음에 또 보고싶은 늘근도둑이야기????"
22001159,819,5,yjinre***예매자,2022.07.31,조회 1080,"공감 0
공감하기","베스트실컷 웃다갑니다.
라이브 후기","공연 오랜만에 보는 친구와 관람했어요.
좋은작품 선택한것 같아 기쁩니다.

오랜만에 웃어서 너무 기분좋아요ㅋㅋㅋㅋ
배우님들 너무 감사합니다

응원할게요!!!!"
22001159,820,5,bmw1***예매자,2022.07.26,조회 999,"공감 0
공감하기",베스트K연극!! 웃음최강!,"몇년만에 간 대학로 소극장!이렇게
완벽하게 시간보내는게 즐겁나요?!
사춘기 온 아이들과 코드맞춰 완전 즐겁게 봤습니다!!

보는 내내 즐겁게 좋은시간 만들어 주셔서 감사합니다!!"
22001159,821,5,treen***예매자,2022.07.25,조회 762,"공감 0
공감하기",베스트봄날의 햇살같은 연극,"서울과 아주 가까운 인천
하지만 늘 멀게만 느껴지는 서울
어쩌다 큰맘먹고 나들이에 나서지만 연극을 관람하려는 무수한 인파에 놀라 너무 문화생활과 동떨어져 지낸건 아닌지 돌아봅니다.
무료한 일상에 신선한 웃음을 생각하고 가볍게 볼 연극을 고르던중 선택한 늘근도둑이야기
시작부터 빵빵 터지는 웃음
어릴적부터 함께 자라온 친구는 저의 웃음소리에 덩달아 웃음바이러스라도 전파된듯
마냥 웃었고
오프닝에 가위바위보를 시작으로
취준생의 애환을 10대부터 30대로 나열할땐 또 같이 웃펐답니다.
그후로도 쭉 배우분들의 몸을 사리지 않는 열연과 수많은 에피소드로 꽉채워준 2시간의 웃음
몇년만에 보는 연극이지만 이연극 한편으로
우쭐 하며 온 연극을 다 본것처럼 자랑해야겠어요.
아직도 이걸 안봤냐?
말이되냐?
나른한 일요일 오후에 봄날의 햇살같이 스며든 연극
덕분에 너무 행복한 시간 보냈습니다.
고맙습니다."
22001159,822,5,rlatkddl***예매자,2022.07.24,조회 766,"공감 0
공감하기",베스트웃다가 울다가 나왔어요.,"처음 시작부터 너무 재밌었어요. 관객분들도 많아서 그런지 호응도 너무 잘 돼서 더 재밌었어요. 진짜 소통 연극이네요.
소통하는 연극 좋아하는 분들은 만족하실 거예요. 시간 떼우려고 봤다가 완전 반해서 나왔어요. 부모님이랑 봐도 좋고
연인끼리 봐도 너무 좋고 재밌는 연극이예요. 배우분들도 호응해주면 소소한 것에도 감사해주시고 너무 감동!! ㅎㅎ
생각보다 극장이 작아서 바로 앞에서 보는 기분이라 너무 좋아요. 박철민배우 보려고 연극 봤다가 다른 배우분들도 너무
재밌어서 웃다가 웃었네요. &#128522; 꼭 보세요. 후회는 없는 연극입니다. ㅎㅎ 뭘 봐야할지 모를 때 보면 좋은 연극!!!"
22001159,823,5,sophia42***예매자,2022.07.21,조회 1047,"공감 0
공감하기",베스트오랫만에 본 일한 배우님과 항호 배우님 연극~^^,"&#65279;제가 본 연극을 보게 된 건 친한 여동생의 추천이기도 했고, 워낙 유명한 작품이라 보고 싶었지만
놓쳐왔던 극이라 이번 기회에 보게 되었습니다.
또한, 오래전부터 알고 있던 배우님께서 출연하시기 때문이었는데요,
배우님을 알게 된 건 9년 쯤 되었는데, 배우님의 캐스팅으로 연극을 보게 된 건 5년 만인 것 같아요~
그래서인지 무대 위에서 다시 배우님을 뵙게 되니까 너무 반가워서 ... 소리를 질렀어요~^^
그랬더니 자연스럽게 (?) 같은 극장 건물 위 층에서 진행되고 있는 공연의 티켓도 선물 받게 되어서
무척이나 좋았답니다. ㅎㅎㅎ
저는 늘 연극을 보면 앞 자리를 사수하는 편이고, 앞 지라에서 보는데, 이번에도 맨 앞 자리에서
보게 되었습니다. 그런데, 제 자리가 ... 세상에나 ... 연극의 한 축이 되는 금고 역할일 줄이야 ...
처음에는 살짝 당황하고 해서 눈도 못 쳐다봤는데 나중에는 즐기게 되면서 신선하고 재미있는 경험을
하게 된 것 같아요~^^
연극의 내용을 말하면 스포일러가 될 것 같아서 내용은 여기까지~!!!!!!!
삶이 지치고, 힘든데 웃을 일이 없을 때 이 연극을 꼭 보시라고 추천드리고싶어요~
저도 많이 힘들어 웃을 일이 없는데 보게 되면서 너무 많이 웃고, 즐거웠거든요~^^"
